Utterance,Speaker,Emotion,Scene_ID,Utterance_ID,Season,Episode,Start_Time,End_Time
"Well, maybe the crazy fog has lifted and she realises that life without me.... a-sucks.",['Ross Geller'],Powerful,5,7,3,19,00:06:40.400,00:06:48.490
"It's possible. You are very loveable, I'd miss you if I broke up with you. I was just trying to be supportive.",['Chandler Bing'],Peaceful,5,8,3,19,00:06:48.658,00:07:01.670
Then be supportive like a guy.,['Ross Geller'],Neutral,5,9,3,19,00:06:56.916,00:07:01.670
"If I broke up with you, I'd miss you.",['Chandler Bing'],Joyful,5,10,3,19,00:06:59.794,00:07:05.048
"So, you're like a zillionaire?",['Phoebe Buffay'],Joyful,7,2,3,19,00:07:02.839,00:07:05.048
And you're our age. You're our age.,['Chandler Bing'],Sad,7,3,3,19,00:09:44.750,00:09:50.755
"Y'know what, you should like, you should buy a state and then just name it after yourself.",['Phoebe Buffay'],Joyful,7,4,3,19,00:09:48.421,00:09:56.553
What like Pete Dakota?,['Peter Becker'],Joyful,7,5,3,19,00:09:51.465,00:09:54.009
"Yeah, or, or, or, Mississ-Pete.",['Phoebe Buffay'],Joyful,7,6,3,19,00:09:54.176,00:09:56.553
"Oh, oh, I got it! Pete-Chicago.",['Joey Tribbiani'],Joyful,7,7,3,19,00:09:58.681,00:10:06.688
That's not a state Joe.,['Chandler Bing'],Mad,7,8,3,19,00:10:00.182,00:10:06.688
"Oh, and Mississ-Pete is?",['Joey Tribbiani'],Mad,7,9,3,19,00:10:02.018,00:10:06.688
"I got to go, so ah, I'll see you guys later.",['Peter Becker'],Neutral,7,10,3,19,00:10:08.316,00:10:18.533
Okay.,['#ALL#'],Neutral,7,11,3,19,00:10:10.693,00:10:13.111
You're our age!,['Chandler Bing'],Mad,7,12,3,19,00:10:15.197,00:10:18.533
"So ah, we on for tomorrow?",['Peter Becker'],Joyful,7,13,3,19,00:10:18.701,00:10:24.956
"Yeah, kinda.",['Phoebe Buffay'],Neutral,7,15,3,19,00:10:22.997,00:10:24.956
Happy?! Is that what I'm supposed to be Vic? Happy?,['Kate Miller'],Joyful,8,2,3,19,00:10:56.447,00:11:03.912
"Well, why don't you tell me what you're supposed to be! Huh? Because I sure as hell can't figure it out! I talk to you and nothin'. You look at me, and it's nothin'. Nothing.",['Joey Tribbiani'],Neutral,8,3,3,19,00:11:04.080,00:11:16.049
"Tasty! I'm really starting to feel like you guys have a history, it's-it's nice.",['The Director'],Powerful,8,4,3,19,00:11:13.589,00:11:30.021
I have a question about this scene.,['Kate Miller'],Neutral,8,5,3,19,00:11:19.178,00:11:30.021
Yes?,['The Director'],Neutral,8,6,3,19,00:11:21.138,00:11:22.305
"Well, I don't understand why Adrienne's attracted to Victor.",['Kate Miller'],Scared,8,7,3,19,00:11:32.692,00:11:37.112
"Peel the onion. First of all, he's good looking.",['The Director'],Powerful,8,8,3,19,00:11:37.279,00:11:43.743
Yeah.,['Joey Tribbiani'],Neutral,8,9,3,19,00:11:40.157,00:11:42.200
I think my character's gonna need a little bit more of reason than that.,['Kate Miller'],Neutral,8,10,3,19,00:11:42.535,00:11:46.955
"Oh, hey, how about this one. Ah, it's says so in the script! Y'know ah, I-I don't know why my character likes you either, I mean it says in the script here that you're a bitch.",['Joey Tribbiani'],Mad,8,11,3,19,00:11:47.123,00:11:59.467
It doesn't say that in the script.,['Kate Miller'],Sad,8,12,3,19,00:11:56.465,00:11:59.467
It does in mine!,['Joey Tribbiani'],Neutral,8,13,3,19,00:12:00.177,00:12:02.929
Ross! You gotta stop! Okay?! You can't just stare through the peep hole for three hours! You're gonna get peep eye!,['Chandler Bing'],Mad,10,2,3,19,00:12:38.007,00:12:51.686
"I knew it! I knew it! I always knew she liked him! Y'know, she'd say no, but here we are! Right? We just broke up, first thing she does!",['Ross Geller'],Mad,10,3,3,19,00:12:46.015,00:12:56.649
You didn't just break up.,['Chandler Bing'],Powerful,10,4,3,19,00:12:48.726,00:12:51.686
"Hey, it's been like three weeks!",['Ross Geller'],Mad,10,5,3,19,00:12:56.859,00:13:00.528
You slept with somebody three hours after you thought you broke up. I mean bullets have left guns slower!,['Chandler Bing'],Mad,10,6,3,19,00:12:58.569,00:13:07.243
Okay.,['Chandler Bing'],Neutral,10,8,3,19,00:13:00.738,00:13:04.073
"She's going in. Wait! He's going in! He's going in!! The door's closed! I, I can't see anything but the door closed!!",['Ross Geller'],Scared,10,9,3,19,00:13:19.548,00:13:32.560
And the inventor of the door rests happily in his grave.,['Chandler Bing'],Peaceful,10,10,3,19,00:13:32.895,00:13:36.564
"Okay, I have to do something. I mean, I have, I have to stop it!",['Ross Geller'],Scared,10,11,3,19,00:13:37.066,00:13:41.194
Stop what?!,['Chandler Bing'],Mad,10,12,3,19,00:13:39.610,00:13:41.194
No!! You can't!!,['Chandler Bing'],Mad,10,15,3,19,00:13:41.362,00:13:44.405
"Look, they must be stopped!",['Ross Geller'],Mad,10,16,3,19,00:13:44.615,00:13:47.158
"I am your friend, and I am not gonna let you do this!! You are surprisingly strong!",['Chandler Bing'],Mad,10,17,3,19,00:13:49.245,00:13:55.792
I need juice! People need juice!!,['Ross Geller'],Scared,10,18,3,19,00:13:51.413,00:13:53.581
Look man!,['Chandler Bing'],Mad,10,19,3,19,00:13:53.749,00:13:55.792
People need juice!,['Ross Geller'],Mad,10,20,3,19,00:13:56.126,00:13:58.503
Listen to me!!,['Chandler Bing'],Mad,10,21,3,19,00:13:59.213,00:14:02.757
"Juice, I need...",['Ross Geller'],Peaceful,10,22,3,19,00:14:02.925,00:14:05.844
"Yeah, okay.",['Ross Geller'],Sad,10,24,3,19,00:14:09.765,00:14:13.977
Okay.,['Chandler Bing'],Powerful,10,25,3,19,00:14:14.144,00:14:16.479
It's just I miss her so much.,['Ross Geller'],Sad,10,26,3,19,00:14:27.032,00:14:32.954
I know.,['Chandler Bing'],Peaceful,10,27,3,19,00:14:30.411,00:14:32.954
Why do all you're coffee mugs have numbers on the bottom?,['Mark Robinson'],Scared,11,2,3,19,00:14:34.164,00:14:40.378
"Oh. That's so Monica can keep track. That way if one on them is missing, she can be like, 'Where's number 27?!'",['Rachel Green'],Neutral,11,3,3,19,00:14:38.127,00:14:47.385
Y'know what?,['Rachel Green'],Neutral,11,5,3,19,00:14:40.629,00:14:43.423
No. And I don't think I'm gonna want to.,['Mark Robinson'],Scared,11,6,3,19,00:14:49.013,00:15:00.315
I can't do this.,['Rachel Green'],Peaceful,11,7,3,19,00:14:56.353,00:15:00.315
"Yep. Yep, that's what I didn't want to know.",['Mark Robinson'],Neutral,11,8,3,19,00:15:00.816,00:15:04.569
"Well, oh, Mark, I'm doing this for the wrong reasons, y'know? I'm just doing it to get back at Ross. I'm sorry, it's not very fair to you.",['Rachel Green'],Sad,11,9,3,19,00:15:05.029,00:15:14.495
Oh God. I'm sorry about this.,['Rachel Green'],Sad,11,11,3,19,00:15:08.574,00:15:11.117
That's okay.,['Mark Robinson'],Peaceful,11,12,3,19,00:15:11.368,00:15:14.495
You sure?,['Rachel Green'],Neutral,11,13,3,19,00:15:16.165,00:15:18.625
Yeah. I can just go home and get back at him by myself.,['Mark Robinson'],Neutral,11,14,3,19,00:15:31.096,00:15:48.488
"Hey, can I ask you something?",['Peter Becker'],Neutral,12,3,3,19,00:15:38.020,00:15:48.488
Sure.,['Monica Geller'],Neutral,12,4,3,19,00:15:41.231,00:15:43.691
Where are we?,['Peter Becker'],Scared,12,5,3,19,00:15:45.235,00:15:48.488
"Well, with all these doctors and nurses, I'm gonna say, midget rodeo.",['Monica Geller'],Peaceful,12,6,3,19,00:16:09.051,00:16:16.599
Just tell me the truth.,['Peter Becker'],Neutral,12,7,3,19,00:16:11.136,00:16:14.430
"Oh, yeah. Wasn't that like a year ago?",['Peter Becker'],Peaceful,12,9,3,19,00:16:31.156,00:16:33.408
"Oh, yeah. I know that.",['Peter Becker'],Neutral,12,11,3,19,00:16:35.577,00:16:37.120
I so wanna be attracted to you.,['Monica Geller'],Scared,12,12,3,19,00:16:43.252,00:16:45.712
"But you're not. Okay, good.",['Peter Becker'],Sad,12,13,3,19,00:16:45.879,00:16:47.797
I'm sorry.,['Monica Geller'],Neutral,12,14,3,19,00:16:50.092,00:16:54.429
"Y'know what, don't be. This is not, don't be, 'cause it's not so bad.",['Peter Becker'],Sad,12,15,3,19,00:16:54.596,00:17:03.396
It's not?,['Monica Geller'],Scared,12,16,3,19,00:16:58.434,00:17:01.102
"I know I'm no John Bon Jovi, or someone who find attractive, I'm just, I think, y'know, that you might end up feeling differently.",['Peter Becker'],Peaceful,12,17,3,19,00:17:04.273,00:17:19.579
"Well, um, look I-I don't want this to come our wrong, but ah, you seem awfully confident for a guy I just told I wasn't attracted too.",['Monica Geller'],Peaceful,12,18,3,19,00:17:13.699,00:17:30.173
"Yeah, stupidly charming isn't' it? Well listen let's, you wanna get something to eat? 'Cause this place is kinda depressing.",['Peter Becker'],Neutral,12,19,3,19,00:17:30.424,00:17:39.182
And the man who made all this possible... Mr. Peter Becker.,['Spokeswoman'],Neutral,12,20,3,19,00:17:36.847,00:17:45.229
One second.,['Peter Becker'],Neutral,12,21,3,19,00:17:40.309,00:17:45.229
I don't think this town is big enough for both of us to relax in. Draw!!,['Chandler Bing'],Joyful,13,2,3,19,00:17:45.856,00:17:59.368
"I wasn't doing anything. Uh-oh, what did she do now?",['Chandler Bing'],Powerful,13,4,3,19,00:18:02.664,00:18:18.262
"Just because she went to Yale drama, she thinks she's like the greatest actress since, since, sliced bread!",['Joey Tribbiani'],Mad,13,5,3,19,00:18:07.711,00:18:23.309
"Ah, Sliced Bread, a wonderful Lady MacBeth.",['Chandler Bing'],Peaceful,13,6,3,19,00:18:23.477,00:18:29.899
"God, I just, I hate her! I hate her!! With her, 'Oh, I'm so talented.' and 'Oh, I'm so pretty,' and 'Ooh, I smell so good.'",['Joey Tribbiani'],Sad,13,7,3,19,00:18:26.772,00:18:38.449
I think somebody has a crush on somebody.,['Chandler Bing'],Joyful,13,8,3,19,00:18:39.535,00:18:41.828
"Hey, Chandler, can we please stay focused on my problem here?! Y'know?",['Joey Tribbiani'],Mad,13,9,3,19,00:18:41.995,00:18:44.872
"I'm talking about you. You big, big freak.",['Chandler Bing'],Peaceful,13,10,3,19,00:18:45.040,00:18:49.669
"Oh. Ohh. Ohh, you're out of your mind.",['Joey Tribbiani'],Scared,13,11,3,19,00:18:52.005,00:18:58.761
"Oh, yeah?! Then how come I keep thinking about her in all these sexual scenarios and stuff huh?!",['Joey Tribbiani'],Mad,13,13,3,19,00:19:03.892,00:19:09.355
Happy?! Is that what I'm supposed to be Vic? Happy?,['Kate Miller'],Mad,14,2,3,19,00:19:06.520,00:19:19.866
"Well, why don't you tell me what you're supposed to be! Huh? Because I sure as hell can't figure it out! I talk to you and it's nothin'. You look at me, and nothin'. Nothing.",['Joey Tribbiani'],Mad,14,3,3,19,00:19:20.033,00:19:45.308
"You guys make me fly! High! Okay, we're gonna pick it up here, tomorrow.",['The Director'],Powerful,14,4,3,19,00:19:28.375,00:19:58.946
"Well, that was ah...",['Kate Miller'],Joyful,14,5,3,19,00:19:44.141,00:19:51.564
Better?,['Joey Tribbiani'],Joyful,14,6,3,19,00:19:47.477,00:19:51.564
"Yeah! Yeah, it was definitely an improvement. G'night.",['Kate Miller'],Joyful,14,7,3,19,00:20:01.283,00:20:07.163
"Ah, Kate?",['Joey Tribbiani'],Neutral,14,8,3,19,00:20:03.952,00:20:07.163
Yeah?,['Kate Miller'],Neutral,14,9,3,19,00:20:07.331,00:20:09.040
"You ah, you forgot your shoes.",['Joey Tribbiani'],Neutral,14,10,3,19,00:20:11.460,00:20:15.671
I'm probably gonna need those. Huh?,['Kate Miller'],Joyful,14,11,3,19,00:20:15.839,00:20:20.801
"Hey, listen you ah....",['Joey Tribbiani'],Neutral,14,12,3,19,00:20:18.300,00:20:20.801
Hmm?,['Kate Miller'],Neutral,14,13,3,19,00:20:24.681,00:20:27.350
...feel like getting a cup of coffee?,['Joey Tribbiani'],Joyful,14,14,3,19,00:20:28.227,00:20:30.478
Umm.,['Kate Miller'],Neutral,14,15,3,19,00:20:31.980,00:20:33.064
Kate?,['The Director'],Neutral,14,16,3,19,00:20:33.232,00:20:35.149
Yep.,['Kate Miller'],Neutral,14,17,3,19,00:20:36.818,00:20:39.904
You ready to go?,['The Director'],Neutral,14,18,3,19,00:20:42.074,00:20:46.369
Yeah.,['Kate Miller'],Neutral,14,19,3,19,00:20:44.493,00:20:46.369
Very nice. Very nice.,['The Director'],Joyful,14,20,3,19,00:20:46.536,00:20:59.340
"Yeah, yeah sure, goodnight.",['Joey Tribbiani'],Sad,14,22,3,19,00:20:58.173,00:21:03.552
"Hey! Why isn't it Spiderman? Y'know like Goldman, Silverman...",['Phoebe Buffay'],Joyful,15,2,3,19,00:21:01.218,00:21:05.596
'Cause it's-it's not his last name.,['Chandler Bing'],Neutral,15,3,3,19,00:21:03.720,00:21:08.808
It isn't?,['Phoebe Buffay'],Sad,15,4,3,19,00:21:06.390,00:21:08.808
"No, it's not like, like Phil Spiderman. He's a spider, man. Y'know like ah, like Goldman is a last name, but there's no Gold Man.",['Chandler Bing'],Joyful,15,5,3,19,00:21:09.351,00:21:26.909
"Oh, okay. There should be Gold Man!",['Phoebe Buffay'],Joyful,15,6,3,19,00:21:24.574,00:21:29.370
Hey!,['Rachel Green'],Joyful,15,7,3,19,00:21:27.452,00:21:29.370
"Hey, Rach, how was work?",['Monica Geller'],Joyful,15,8,3,19,00:21:29.538,00:21:31.205
"Oh, great. Although I did sit down where there wasn't a chair.",['Rachel Green'],Peaceful,15,9,3,19,00:21:33.917,00:21:40.381
"By the way, Ross dropped by a box of your stuff.",['Monica Geller'],Neutral,15,10,3,19,00:21:37.462,00:21:43.718
"Oh, well, I guess I had that one coming. I'm just gonna throw it out, it's probably just a bunch of shampoo and...",['Rachel Green'],Sad,15,11,3,19,00:21:41.258,00:21:51.392
Something wrong?,['Monica Geller'],Scared,15,12,3,19,00:21:43.927,00:21:47.221
No. Nothing.,['Rachel Green'],Sad,15,13,3,19,00:21:47.723,00:21:51.392
"So, ahh, what kind of powers would Gold Man have?",['Chandler Bing'],Joyful,16,2,3,19,00:21:52.936,00:22:15.791
"Okay well, he would turn things to gold.",['Phoebe Buffay'],Neutral,16,3,3,19,00:22:17.044,00:22:20.212
What about things that are already gold?,['Chandler Bing'],Neutral,16,4,3,19,00:22:20.797,00:22:24.925
"Ahh, his work is done.",['Phoebe Buffay'],Peaceful,16,5,3,19,00:22:26.595,00:22:27.845
"Okay, let's play my game now.",['Chandler Bing'],Joyful,16,6,3,19,00:22:28.013,00:22:32.975
Okay. All right you yellow-bellied-lilly-livered-DRAW!!,['Phoebe Buffay'],Joyful,16,7,3,19,00:22:29.264,00:22:32.975
Here you go. You can wear this.,['Monica Geller'],Neutral,2,2,3,22,00:01:24.793,00:01:30.297
Thanks!,['Phoebe Buffay'],Joyful,2,3,3,22,00:01:27.796,00:01:30.297
Uh-huh.,['Monica Geller'],Neutral,2,4,3,22,00:01:32.634,00:01:34.426
"Okay. Ooh, I'm setting the phone down. But I'm still here! Just don't go anywhere I'm still here. Don't-don't switch or anything, 'cause I'm, I'm right here. Just one sec. One sec! One second!! Wait! One second! Just...",['Phoebe Buffay'],Scared,2,5,3,22,00:02:51.171,00:03:14.401
Phoebe?,['Monica Geller'],Neutral,2,6,3,22,00:02:55.258,00:02:57.634
"What?! Monica, I'm scared!!",['Phoebe Buffay'],Scared,2,7,3,22,00:02:58.303,00:03:00.220
"All right. Honey, that's-that's a sleeve. Okay?",['Monica Geller'],Peaceful,2,8,3,22,00:03:14.569,00:03:20.991
Yeah.,['Phoebe Buffay'],Neutral,2,9,3,22,00:03:17.363,00:03:20.991
And! We also have speaker phone.,['Monica Geller'],Peaceful,2,10,3,22,00:03:21.159,00:03:25.704
"Please, stay on the line. Your call is important to us.",['Hold Voice'],Neutral,2,11,3,22,00:03:23.870,00:03:27.206
"Okay, wait, you gotta hang up 'cause we're gonna be late.",['Monica Geller'],Neutral,2,12,3,22,00:03:25.872,00:03:29.416
"Thank you for your patience, you're the next caller.",['Hold Voice'],Neutral,2,14,3,22,00:03:29.584,00:03:32.461
Yes!! Yes!! I'm the next caller! You were gonna have me hang up.,['Phoebe Buffay'],Joyful,2,15,3,22,00:03:32.629,00:03:37.841
Hey! Can you take a duck and a chick to the theatre?,['Chandler Bing'],Joyful,2,16,3,22,00:03:35.465,00:03:43.847
Of course not.,['Monica Geller'],Mad,2,17,3,22,00:03:39.677,00:03:43.847
No.,['Phoebe Buffay'],Neutral,2,18,3,22,00:03:41.512,00:03:43.847
Okay. I just wanted them to hear it from somebody else.,['Chandler Bing'],Peaceful,2,19,3,22,00:03:45.183,00:03:49.770
Hey!,['Monica Geller'],Joyful,5,2,3,22,00:03:46.684,00:03:49.770
Hey!,['Rachel Green'],Joyful,5,3,3,22,00:03:57.278,00:03:59.905
"Oh, is the play over?",['Phoebe Buffay'],Scared,5,4,3,22,00:04:00.073,00:04:06.161
Yeah. Where were you?,['Monica Geller'],Mad,5,5,3,22,00:04:02.700,00:04:06.161
"Thank you for your patience, you're the next caller.",['Hold Voice'],Neutral,5,6,3,22,00:09:23.020,00:09:27.190
You were the next caller five hours ago. You must be going crazy.,['Monica Geller'],Neutral,5,7,3,22,00:09:25.231,00:09:31.027
Nah. I kept myself busy.,['Phoebe Buffay'],Neutral,5,8,3,22,00:09:27.400,00:09:31.027
"Oh, okay, yeah. I put your stuff in her room, and her stuff in your room.",['Phoebe Buffay'],Neutral,5,10,3,22,00:09:31.195,00:09:45.041
Hey! Are you okay?,['Joey Tribbiani'],Peaceful,6,2,3,22,00:09:41.789,00:09:45.041
Fabulous.,['Kate Miller'],Scared,6,3,3,22,00:09:50.381,00:09:51.881
"Listen, drama critics they're nothing but, but people who couldn't make it as actors. You know what you should do?",['Joey Tribbiani'],Peaceful,6,4,3,22,00:09:52.174,00:10:03.226
Become a drama critic!,['Kate Miller'],Neutral,6,5,3,22,00:09:54.510,00:10:00.765
I am hurt! A plague on both your houses!,['The Director'],Sad,6,6,3,22,00:10:03.603,00:10:17.198
"By the way, he dumped me tonight after he read my review.",['Kate Miller'],Sad,6,7,3,22,00:10:08.149,00:10:22.746
"Oh, classy.",['Joey Tribbiani'],Powerful,6,8,3,22,00:10:12.528,00:10:14.195
"Yep! I sure know how to pick 'em, huh? Y'know I gave up a part on a soap for this!",['Kate Miller'],Powerful,6,9,3,22,00:10:22.913,00:10:32.589
"Wow! Yeah I ah, I gave up a job too.",['Joey Tribbiani'],Joyful,6,10,3,22,00:10:25.291,00:10:32.589
Really. What?,['Kate Miller'],Scared,6,11,3,22,00:10:26.959,00:10:29.252
"Uh, de-clawing cats. Hey, tell ya what. Let me walk you home. We'll stop by every news stand and burn every copy of their Times and the Post.",['Joey Tribbiani'],Powerful,6,12,3,22,00:10:33.174,00:10:49.939
Why the Post?,['Kate Miller'],Sad,6,13,3,22,00:10:34.675,00:10:37.719
"Oh, you didn't see the Post?",['Joey Tribbiani'],Sad,6,14,3,22,00:10:37.887,00:10:45.560
No. You?,['Kate Miller'],Scared,6,15,3,22,00:10:42.767,00:10:45.560
No. Why?,['Joey Tribbiani'],Powerful,6,16,3,22,00:10:45.728,00:10:49.939
So you really think those newspapers are just jealous of me?,['Kate Miller'],Scared,7,2,3,22,00:10:52.693,00:11:05.997
"Oh, absolutely! You're talented and you're good looking.",['Joey Tribbiani'],Joyful,7,3,3,22,00:11:06.165,00:11:12.462
"Oh, you're sweet and cute.",['Kate Miller'],Joyful,7,4,3,22,00:11:09.835,00:11:12.462
I know! That's why they trashed me!,['Joey Tribbiani'],Sad,7,5,3,22,00:11:12.630,00:11:15.048
"Whoa. Wait a minute, wait a minute.",['Joey Tribbiani'],Joyful,7,7,3,22,00:11:22.264,00:11:28.186
What?,['Kate Miller'],Neutral,7,8,3,22,00:11:26.352,00:11:28.186
What? So you never went out with an actress before?,['Kate Miller'],Neutral,7,10,3,22,00:11:36.821,00:11:39.447
"Kate, do you even like me?",['Joey Tribbiani'],Joyful,7,11,3,22,00:11:40.866,00:11:43.660
Of course I do.,['Kate Miller'],Joyful,7,12,3,22,00:11:46.455,00:11:50.166
Thanks.,['Joey Tribbiani'],Joyful,7,15,3,22,00:11:50.334,00:11:53.962
"You know what I mean. I mean like the sweetest guy. Joey, you're just so, you're so, so...",['Kate Miller'],Joyful,7,16,3,22,00:12:08.477,00:12:24.075
Please stay on the line. You're call is very important to us.,['Hold Voice'],Neutral,8,2,3,22,00:13:11.123,00:13:15.210
"Pheebs, you've been up for 24 hours! Go to sleep, honey. Th-this isn't healthy.",['Monica Geller'],Peaceful,8,3,3,22,00:13:13.083,00:13:19.798
"No, no, I'm fine, and y'know why? 'Cause of all the riboflavin.",['Phoebe Buffay'],Peaceful,8,4,3,22,00:13:19.965,00:13:26.638
Hey!,['Joey Tribbiani'],Joyful,8,5,3,22,00:13:23.135,00:13:26.638
Hey! Didn't you have that outfit on last night?,['Monica Geller'],Peaceful,8,6,3,22,00:13:29.225,00:13:34.062
"Yeah! I stayed at Kate's, but ah, nothing happened. Hey, Pheebs, where were ya?",['Joey Tribbiani'],Peaceful,8,7,3,22,00:13:34.230,00:13:39.651
"Anyway, how did it go with Kate?",['Monica Geller'],Peaceful,8,9,3,22,00:13:52.248,00:13:54.666
"Joey, you had the night!",['Monica Geller'],Powerful,8,11,3,22,00:13:54.834,00:13:56.251
What?,['Joey Tribbiani'],Neutral,8,12,3,22,00:13:56.418,00:13:59.712
"When two people finally realise their feelings for each other, and-and they talk for hours, and they-they learn all about the other person!",['Monica Geller'],Powerful,8,13,3,22,00:14:08.764,00:14:19.274
You-you think?,['Joey Tribbiani'],Joyful,8,14,3,22,00:14:12.518,00:14:15.270
Did you like learn about her family?,['Monica Geller'],Peaceful,8,15,3,22,00:14:15.437,00:14:19.274
"Two brothers, one died!",['Joey Tribbiani'],Sad,8,16,3,22,00:14:19.441,00:14:23.611
Yes!!,['Monica Geller'],Powerful,8,17,3,22,00:14:20.651,00:14:23.611
Yeah?!,['Joey Tribbiani'],Sad,8,18,3,22,00:14:23.779,00:14:25.613
Oh!,['Monica Geller'],Peaceful,8,19,3,22,00:14:32.079,00:14:33.997
"Sorry! Sorry, I'm late; sorry, I'm late! My duck and my chick and a fight, it-it was ugly.",['Joey Tribbiani'],Scared,10,2,3,22,00:16:35.703,00:16:46.504
"Look, we held the curtain for you buddy. Come on, let's go! Let's go!",['Stage Manager'],Powerful,10,3,3,22,00:16:47.089,00:16:58.433
"Vic! Where have you been, baby?!",['Lauren'],Joyful,10,5,3,22,00:16:49.925,00:16:58.433
Where's Kate?,['Joey Tribbiani'],Joyful,10,6,3,22,00:16:54.847,00:16:58.433
She got a job in L.A.,['Lauren'],Joyful,10,7,3,22,00:17:02.229,00:17:04.731
What?!,['Joey Tribbiani'],Neutral,10,8,3,22,00:17:05.733,00:17:07.066
I've been waiting up all night for ya. Where have you been? Where have you been? Vic?!,['Lauren'],Mad,10,9,3,22,00:17:07.609,00:17:15.783
"Oh, ahh, go to the window. I'm wanna run down to the truck and show you something.",['Joey Tribbiani'],Powerful,10,10,3,22,00:17:13.365,00:17:21.664
"What do you got down there, Vic? What do you got under that tarp?",['Lauren'],Neutral,10,11,3,22,00:17:24.043,00:17:28.421
When is she leaving?,['Joey Tribbiani'],Peaceful,10,12,3,22,00:17:26.628,00:17:28.421
Tonight. What are you doing?,['Lauren'],Scared,10,13,3,22,00:17:32.342,00:17:36.345
I'm coming up!,['Joey Tribbiani'],Powerful,10,14,3,22,00:17:33.802,00:17:36.345
"Hey, mind if I use the phone?",['Tommy'],Neutral,11,2,3,22,00:17:38.015,00:17:44.479
"Oh, I...",['Phoebe Buffay'],Scared,11,3,3,22,00:17:42.644,00:17:44.479
"Why don't you use ours across the hall, 'cause she...has...problems.",['Chandler Bing'],Neutral,11,4,3,22,00:17:44.646,00:17:52.862
"Oh-ho, whoa! Sorry, Tommy. I almost spilled this hot coffee on you.",['Ross Geller'],Peaceful,11,5,3,22,00:17:53.030,00:18:02.747
"Yeah, but you didn't.",['Tommy'],Joyful,11,6,3,22,00:17:54.615,00:18:02.747
"No, but it's-it's-it's hot!",['Ross Geller'],Scared,11,7,3,22,00:17:56.992,00:18:02.747
"Ross, would you just stop it! It's getting really old.",['Rachel Green'],Mad,11,9,3,22,00:18:05.834,00:18:15.134
I can't believe no one believes me!,['Ross Geller'],Mad,11,10,3,22,00:18:15.302,00:18:17.345
"I do, I believe you.",['Phoebe Buffay'],Powerful,11,11,3,22,00:18:17.679,00:18:19.097
You do Pheebs?,['Ross Geller'],Neutral,11,12,3,22,00:18:19.556,00:18:20.640
Yeah. But I also believed her when she said I was next.,['Phoebe Buffay'],Joyful,11,13,3,22,00:18:20.808,00:18:24.185
Step away from the duck.,['Chandler Bing'],Mad,11,17,3,22,00:18:27.564,00:18:33.820
"Ooh, sorry little Mr. Chic-A-Dee, sorry you went doody in my hand! Well, I guess we're not going out anymore. Whaa!!!",['Tommy'],Mad,11,18,3,22,00:18:59.471,00:19:20.575
Joey!,['Kate Miller'],Joyful,12,2,3,22,00:19:05.269,00:19:07.895
Hey!,['Joey Tribbiani'],Joyful,12,3,3,22,00:19:11.066,00:19:13.192
"I'm soo glad I caught you, I couldn't find you before.",['Kate Miller'],Joyful,12,4,3,22,00:19:20.742,00:19:29.959
Wh-wh-what's going on? Wh-what's this about L.A.?,['Joey Tribbiani'],Powerful,12,5,3,22,00:19:30.127,00:19:32.336
They still want me for General Hospital.,['Kate Miller'],Neutral,12,6,3,22,00:19:32.504,00:19:34.589
"But, but wh-what about us?",['Joey Tribbiani'],Powerful,12,7,3,22,00:19:34.798,00:19:41.679
Last night was wonderful. But I-I can't stay here just for you.,['Kate Miller'],Peaceful,12,8,3,22,00:19:38.969,00:19:44.098
"Well, so, stay for the museums!",['Joey Tribbiani'],Joyful,12,9,3,22,00:19:42.097,00:19:44.098
I'm sorry.,['Kate Miller'],Sad,12,10,3,22,00:19:44.349,00:19:47.101
"Joey, onstage!",['Stage Manager'],Powerful,12,11,3,22,00:19:48.103,00:19:50.354
Where are you Vic?,['Lauren'],Powerful,12,13,3,22,00:19:51.106,00:19:53.274
Flight's in an hour. I-I gotta go.,['Kate Miller'],Sad,12,14,3,22,00:19:56.445,00:20:00.698
Vic! Vic! Vic!!!,['Lauren'],Neutral,12,15,3,22,00:19:58.530,00:20:00.698
In a minute!!,['Joey Tribbiani'],Neutral,12,16,3,22,00:20:00.866,00:20:03.910
So this is it? Victor?,['Lauren'],Powerful,12,18,3,22,00:20:02.492,00:20:07.455
"So long, Vic!",['Lauren'],Sad,12,21,3,22,00:20:05.454,00:20:07.455
"Phoebe, it's been two days.",['Monica Geller'],Scared,13,2,3,22,00:20:09.583,00:20:11.959
"Yeah, I know. Oh, good thing it's one of those 801 numbers. Right?",['Phoebe Buffay'],Joyful,13,3,3,22,00:21:34.293,00:21:51.225
"Phoebe, 800 is toll free, 801 is-is Utah.",['Ross Geller'],Neutral,13,4,3,22,00:21:51.393,00:21:56.480
Phoe-be!!,['Rachel Green'],Neutral,13,6,3,22,00:21:59.067,00:22:00.192
"Sorry, I'm so sorry, I will pay you back.",['Phoebe Buffay'],Sad,13,7,3,22,00:22:05.741,00:22:13.831
"And yet, she's still not hanging up the phone.",['Chandler Bing'],Scared,13,8,3,22,00:22:13.999,00:22:16.834
Hang it up! Hang up the phone!!,['#ALL#'],Powerful,13,9,3,22,00:22:17.002,00:22:20.421
Fine! Fine! Oh-oh!,['Phoebe Buffay'],Mad,13,10,3,22,00:22:18.879,00:22:22.381
What?,['Monica Geller'],Mad,13,11,3,22,00:22:20.589,00:22:22.381
"Well, I think I broke it. But that's all right, here's the number you can call.",['Phoebe Buffay'],Peaceful,13,12,3,22,00:22:25.093,00:22:34.602
Oh.,['Monica Geller'],Mad,13,13,3,22,00:22:27.888,00:22:30.348
"Hey, wouldn't be cool if our duck and chick had a little baby? We could call it Chuck.",['Joey Tribbiani'],Joyful,1,2,3,23,00:00:03.253,00:00:08.674
Or... Dick.,['Chandler Bing'],Neutral,1,3,3,23,00:00:06.548,00:00:08.674
Hey.,['Ross Geller'],Neutral,1,4,3,23,00:00:10.343,00:00:12.219
Hey.,"['Chandler Bing', 'Joey Tribbiani']",Neutral,1,5,3,23,00:00:13.722,00:00:15.681
