Utterance,Speaker,Emotion,Scene_ID,Utterance_ID,Season,Episode,Start_Time,End_Time
You go girl. I can't pull that off can I?,['Monica Geller'],Powerful,4,14,2,19,00:06:23.424,00:06:30.138
"Excuse me, your, your, your wind?",['Ross Geller'],Mad,4,15,2,19,00:06:31.933,00:06:36.603
"Yes, my wind. How do you expect me to grow if you won't let me blow?",['Rachel Green'],Powerful,4,16,2,19,00:06:35.103,00:06:39.648
"Ok, I just, I just really need to be with myself right now. I'm sorry.",['Rachel Green'],Peaceful,4,18,2,19,00:06:46.864,00:07:08.427
"Um-um, um-um.",['Phoebe Buffay'],Neutral,4,19,2,19,00:06:51.494,00:06:53.703
"You're right, I don't have to apologize. Sorry. Damnit!",['Rachel Green'],Mad,4,20,2,19,00:07:10.805,00:07:14.683
Hey pal.,['Eddie Menuek'],Neutral,6,2,2,19,00:07:13.307,00:07:14.683
Ahhhh-gaaaahhh. Eddie what're you still doin' here?,['Chandler Bing'],Mad,6,3,2,19,00:09:35.825,00:09:52.465
"Ah, just some basic dehydrating of a few fruits and vegetables. MAN ALIVE this thing's fantastic!",['Eddie Menuek'],Joyful,6,4,2,19,00:09:54.343,00:10:01.683
"Look Eddie, aren't you forgetting anything?",['Chandler Bing'],Neutral,6,5,2,19,00:09:59.140,00:10:04.769
"Maybe 'cause the last one was made by Pepperidge Farm. Look Eddie, isn't there something else you're supposed to be doing right now?",['Chandler Bing'],Mad,6,7,2,19,00:10:07.315,00:10:17.741
"Well, not unless it's got something to do with dehydrating my man because right now I'm a dehydrating maniac!",['Eddie Menuek'],Joyful,6,8,2,19,00:10:17.908,00:10:27.876
"Ah-ah-ah, you know what that is?",['Eddie Menuek'],Joyful,6,10,2,19,00:10:29.879,00:10:32.922
Your last roommate's kidney?,['Chandler Bing'],Neutral,6,11,2,19,00:10:31.756,00:10:32.922
That's a tomato. This one definitely goes in the display.,['Eddie Menuek'],Neutral,6,12,2,19,00:10:33.090,00:10:38.762
"Hey Gunther, let me get a lemonade to go.",['Joey Tribbiani'],Neutral,7,2,2,19,00:10:38.929,00:10:51.775
Lemonade? You ok man?,['Gunther'],Scared,7,3,2,19,00:10:43.017,00:10:44.100
"Oh, that's too bad. How'd they do it?",['Gunther'],Neutral,7,5,2,19,00:11:00.660,00:11:03.411
I fell down an elevator shaft.,['Joey Tribbiani'],Sad,7,6,2,19,00:11:03.579,00:11:05.538
That sucks. I was buried in an avalanche.,['Gunther'],Sad,7,7,2,19,00:11:05.706,00:11:09.751
What?,['Joey Tribbiani'],Scared,7,8,2,19,00:11:08.125,00:11:09.751
I used to be Bryce on All My Children.,['Gunther'],Neutral,7,9,2,19,00:11:11.295,00:11:15.131
Daaahhhh!,['Chandler Bing'],Joyful,8,3,2,19,00:11:12.546,00:11:15.131
Aaahhhhhhh! Aaahhhh!,['Monica Geller'],Scared,8,4,2,19,00:11:33.109,00:11:36.444
"Why must everybody watch me sleep? There'll be no more watching me sleep, no more watching.",['Chandler Bing'],Mad,8,5,2,19,00:11:37.071,00:11:42.867
I wa-,['Monica Geller'],Neutral,8,6,2,19,00:11:39.281,00:11:41.616
Uuuh.,['Chandler Bing'],Neutral,8,7,2,19,00:11:41.784,00:11:42.867
"Get out. Get out, get out, get out, get out, get out, get out.",['Chandler Bing'],Mad,9,3,2,19,00:11:56.590,00:12:07.267
What?,['Eddie Menuek'],Sad,9,4,2,19,00:12:01.303,00:12:02.929
"You, you want, you want me to move out?",['Eddie Menuek'],Sad,9,6,2,19,00:12:07.435,00:12:17.694
Uh-huh.,['Chandler Bing'],Mad,9,7,2,19,00:12:13.274,00:12:15.150
"This is not out of the blue, this is smack dab in the middle of the blue.",['Chandler Bing'],Mad,9,9,2,19,00:12:23.743,00:12:29.414
You want some help.,['Chandler Bing'],Mad,9,11,2,19,00:12:25.453,00:12:27.579
No help required Chico.,['Eddie Menuek'],Scared,9,12,2,19,00:12:27.955,00:12:32.083
"All the way to the airport huh? You know that's over 30 miles, that's gonna cost you about so bucks.",['Joey Tribbiani'],Neutral,10,2,2,19,00:12:48.768,00:13:06.242
"Excuse me, that's 50 bucks.",['Casting Guy'],Mad,10,3,2,19,00:12:59.403,00:13:02.739
What?,['Joey Tribbiani'],Neutral,10,4,2,19,00:13:02.907,00:13:06.242
Five oh dollars.,['Casting Guy'],Powerful,10,5,2,19,00:13:06.410,00:13:08.661
That's great.,['Casting Guy'],Mad,10,7,2,19,00:13:09.705,00:13:12.832
"Ok, listen, thanks for coming in.",['Casting Guy'],Powerful,10,9,2,19,00:13:33.979,00:13:36.064
"Ok, question number 28, have you ever allowed a lighning bearer to take your wind? I would have to say no.",['Phoebe Buffay'],Peaceful,11,2,2,19,00:14:00.548,00:14:15.270
And I would have to say pah-huh.,['Monica Geller'],Peaceful,11,3,2,19,00:14:01.799,00:14:12.767
What?,['Phoebe Buffay'],Scared,11,4,2,19,00:14:06.554,00:14:08.471
Do you not remember the puppet guy?,['Monica Geller'],Scared,11,5,2,19,00:14:20.568,00:14:23.570
Yeah you like totally let him wash his feet in the pool of your inner power.,['Rachel Green'],Joyful,11,6,2,19,00:14:21.819,00:14:28.741
And his puppet too.,['Monica Geller'],Joyful,11,7,2,19,00:14:23.737,00:14:28.741
"Yeah ok, well at least I didn't let some guy into the forest of my righteous truth on the first date.",['Phoebe Buffay'],Mad,11,8,2,19,00:14:30.244,00:14:37.500
Who?,['Monica Geller'],Scared,11,9,2,19,00:14:32.162,00:14:34.372
Paul.,['Phoebe Buffay'],Neutral,11,10,2,19,00:14:34.623,00:14:37.500
Oh.,['Monica Geller'],Peaceful,11,11,2,19,00:14:41.881,00:14:43.214
"Woah, woah, woah, let's go back to 29.",['Monica Geller'],Neutral,11,13,2,19,00:14:53.309,00:14:59.314
"Not uh, not to my recollection.",['Rachel Green'],Neutral,11,14,2,19,00:14:56.395,00:14:59.314
Only 'cause you took up half the circle.,['Rachel Green'],Powerful,11,16,2,19,00:15:12.036,00:15:14.787
Listen to you two. It's so sad. Looks like I'm gonna be going to the goddess meetings alone.,['Phoebe Buffay'],Sad,11,17,2,19,00:15:14.997,00:15:24.923
Well not when they find out you slept with Jason Hurley an hour after he broke up with Monica.,['Rachel Green'],Peaceful,11,18,2,19,00:15:25.090,00:15:36.100
One hour? You are such a leaf blower.,['Monica Geller'],Mad,11,19,2,19,00:15:34.224,00:15:39.687
May I help you?,['Chandler Bing'],Neutral,14,3,2,19,00:15:36.268,00:15:39.687
Why doesn't my key work and what's all my stuff doin' downstairs?,['Eddie Menuek'],Mad,14,4,2,19,00:19:45.142,00:20:11.334
"Well, I'm, I'm sorry... Ahhh. Have we met?",['Chandler Bing'],Scared,14,5,2,19,00:20:11.919,00:20:18.799
"It's Eddie you freak, your roommate.",['Eddie Menuek'],Mad,14,6,2,19,00:20:15.005,00:20:18.799
"I, I'm sorry, I uh I already have a roommate.",['Chandler Bing'],Scared,14,7,2,19,00:20:19.843,00:20:27.725
Hello.,['Joey Tribbiani'],Neutral,14,8,2,19,00:20:22.137,00:20:24.388
"Yeah, he's lived here for years, I don't, I don't know what you're talking about man.",['Chandler Bing'],Scared,14,9,2,19,00:20:26.516,00:20:37.985
"No he, he moved out and I moved in.",['Eddie Menuek'],Mad,14,10,2,19,00:20:36.109,00:20:42.240
"Well I, I think we'd remember something like that.",['Chandler Bing'],Neutral,14,11,2,19,00:20:38.654,00:20:45.701
I know I would.,['Joey Tribbiani'],Neutral,14,12,2,19,00:20:43.659,00:20:45.701
Hey no problem.,['Joey Tribbiani'],Neutral,14,14,2,19,00:20:45.869,00:20:49.455
Welcome home man.,['Chandler Bing'],Joyful,14,17,2,19,00:20:47.329,00:20:49.455
A little foos?,['Joey Tribbiani'],Neutral,14,18,2,19,00:20:50.374,00:20:52.375
Absolutely.,['Chandler Bing'],Joyful,14,19,2,19,00:20:52.960,00:20:54.043
What happened to the foosball?,['Joey Tribbiani'],Neutral,14,20,2,19,00:20:54.253,00:20:56.504
Ah that's a cantelope.,['Chandler Bing'],Neutral,14,21,2,19,00:20:58.465,00:21:02.009
"Hey look, are we gonna have to bring this out every time Ross comes over?",['Chandler Bing'],Mad,15,2,2,19,00:21:40.340,00:22:00.234
He paid a lot of money for it.,['Joey Tribbiani'],Powerful,15,3,2,19,00:22:00.402,00:22:01.986
"Well, I had a whole ceramic zoo thing goin' over there but now, without the other ones, it just looks tacky.",['Joey Tribbiani'],Sad,15,5,2,19,00:22:16.209,00:22:27.219
"Hey Monica, why are we watchin' the business channel?",['Joey Tribbiani'],Scared,1,2,2,21,00:00:02.335,00:00:07.131
"Ok honey, you really need a job.",['Rachel Green'],Neutral,1,4,2,21,00:00:14.597,00:00:21.061
"Mon, speaking of which, dad says he knows someone you can call for an interview.",['Ross Geller'],Neutral,1,5,2,21,00:00:17.517,00:00:25.357
Really.,['Monica Geller'],Scared,1,6,2,21,00:00:21.229,00:00:22.312
"Ok, right there. That, that's the third sign today. Right there.",['Phoebe Buffay'],Scared,1,7,2,21,00:00:25.525,00:00:33.699
"On behalf of everyone, I'd just like to say behuh.",['Ross Geller'],Neutral,1,8,2,21,00:00:30.321,00:00:33.699
"No, 'cause you just said dad and everywhere I go today I keep getting signs telling me to go see my father. Like when I was walking over here and I passed a buffet...which is my father's last name.",['Phoebe Buffay'],Powerful,1,9,2,21,00:00:34.284,00:00:47.337
Ahh.,['#ALL#'],Neutral,1,10,2,21,00:00:37.829,00:00:40.456
And they were serving franks which is his first name minus the s at the end. And there was a rotisserie with spinning chicken.,['Phoebe Buffay'],Scared,1,11,2,21,00:00:49.424,00:00:59.683
His indian name?,['Monica Geller'],Scared,1,12,2,21,00:00:51.384,00:00:53.927
No because I chickened out the last time when I tried to meet him. So I mean coincidences? I don't think so.,['Phoebe Buffay'],Mad,1,13,2,21,00:00:55.847,00:01:11.361
Freakish.,['Ross Geller'],Neutral,1,14,2,21,00:00:59.851,00:01:02.478
Wow.,['Monica Geller'],Joyful,1,15,2,21,00:01:02.687,00:01:07.149
Freaky.,['Joey Tribbiani'],Scared,1,16,2,21,00:01:07.859,00:01:11.361
"Weird, weird.",['Monica Geller'],Scared,1,17,2,21,00:01:11.571,00:01:13.864
"Ok, so uh, who wants the last hamburger?",['Rachel Green'],Joyful,1,18,2,21,00:01:14.074,00:01:18.118
"Oh, alright, that's it, now I have to go see him.",['Phoebe Buffay'],Scared,1,19,2,21,00:01:15.950,00:01:18.118
Why?,['Monica Geller'],Scared,1,20,2,21,00:01:18.328,00:01:19.411
"Hamburger. McDonald's. Old MacDonald had a farm, my dad is a pharmacist.",['Phoebe Buffay'],Neutral,1,21,2,21,00:01:19.579,00:01:25.918
"Man, I am so beat.",['Chandler Bing'],Neutral,2,2,2,21,00:01:22.999,00:01:25.918
Oh yeah.,['Ross Geller'],Neutral,2,3,2,21,00:01:26.086,00:01:27.836
"Hey, you just wanna forget about raquetball and hang out here?",['Chandler Bing'],Peaceful,2,4,2,21,00:02:15.176,00:02:20.639
Yeah alright.,['Ross Geller'],Neutral,2,5,2,21,00:02:16.594,00:02:18.178
Hey you're in our seats.,['Big Bully'],Mad,2,6,2,21,00:02:18.346,00:02:20.639
"Oh, sorry we didn't know.",['Ross Geller'],Scared,2,7,2,21,00:02:20.807,00:02:28.814
"Hey, we were sitting there.",['Little Bully'],Mad,2,8,2,21,00:02:25.436,00:02:28.814
"Ok, there is one more way to say it, who knows it?",['Chandler Bing'],Mad,2,9,2,21,00:02:28.982,00:02:33.986
Is that supposed to be funny?,['Little Bully'],Mad,2,10,2,21,00:02:30.859,00:02:33.986
"No actually, I was just going for colorful.",['Chandler Bing'],Scared,2,11,2,21,00:02:34.154,00:02:42.077
What's with this guy?,['Big Bully'],Mad,2,12,2,21,00:02:37.365,00:02:42.077
What's with you?,['Little Bully'],Mad,2,13,2,21,00:02:42.245,00:02:43.996
"Uh, nothing, nothing's with him. Enjoy your coffee.",['Ross Geller'],Scared,2,14,2,21,00:02:44.205,00:02:48.375
What just happened?,['Chandler Bing'],Mad,2,15,2,21,00:02:46.916,00:02:48.375
"I just took your hat. See, I can be funny too. My, my joke is that I, I took your hat.",['Little Bully'],Mad,2,16,2,21,00:02:55.341,00:03:05.100
"That, that is funny. Can I have it back?",['Chandler Bing'],Scared,2,17,2,21,00:03:02.015,00:03:07.644
No.,['Little Bully'],Mad,2,18,2,21,00:03:05.268,00:03:07.644
No?,['Chandler Bing'],Mad,2,19,2,21,00:03:08.396,00:03:09.646
No.,['Big Bully'],Mad,2,20,2,21,00:03:09.856,00:03:10.981
"Ok, ok, you know what? I think you're very funny. Kudos on that hat joke. But, come on guy just, just give him back the hat.",['Ross Geller'],Mad,2,21,2,21,00:03:12.901,00:03:28.999
Why should we?,['Big Bully'],Mad,2,22,2,21,00:03:14.360,00:03:18.030
"Because it's a special hat. See he bought it 'cause he was feeling really down one day so he got the hat to cheer himself up, ya know. Now Chandler...",['Ross Geller'],Peaceful,2,23,2,21,00:03:29.500,00:03:45.557
"Stop talking, stop talking now. Let me just get this straight. You're actually stealing my hat?",['Chandler Bing'],Mad,2,24,2,21,00:03:39.302,00:03:49.645
You got a problem with that?,['Big Bully'],Mad,2,25,2,21,00:03:49.812,00:03:53.774
"No, just wanna make sure we're on the same page.",['Chandler Bing'],Scared,2,26,2,21,00:03:51.064,00:03:53.774
"See, didn't I tell ya these pillows would be a good idea?",['Joey Tribbiani'],Powerful,4,3,2,21,00:05:39.297,00:05:54.436
"Oh God, here we go. For the first time in my life I'm gonna say 'Hi birthfather'.",['Phoebe Buffay'],Scared,4,4,2,21,00:05:55.063,00:06:02.986
"We love you, we're here for you.",['Rachel Green'],Peaceful,4,5,2,21,00:05:57.065,00:06:02.986
"Yeah good luck, good luck.",['Joey Tribbiani'],Peaceful,4,6,2,21,00:05:59.067,00:06:02.986
Thanks.,['Phoebe Buffay'],Powerful,4,7,2,21,00:06:03.654,00:06:05.822
"Hey Rach, you uh, you want some sandwich?",['Joey Tribbiani'],Peaceful,4,8,2,21,00:06:05.990,00:06:12.621
"Ohh, what is in that?",['Rachel Green'],Neutral,4,9,2,21,00:06:10.953,00:06:12.621
"Olive loaf and ham spread, no mayo.",['Joey Tribbiani'],Neutral,4,10,2,21,00:06:12.789,00:06:17.501
"No no, 'cause mayo, that would make it gross.",['Rachel Green'],Neutral,4,11,2,21,00:06:15.291,00:06:20.587
"Hey, hey, no, oh oh.",['Phoebe Buffay'],Scared,4,12,2,21,00:06:17.668,00:06:20.587
Run Phoebe run.,['Rachel Green'],Scared,4,13,2,21,00:06:20.797,00:06:24.508
Are you kidding me?,['Rachel Green'],Mad,4,16,2,21,00:06:24.717,00:06:27.302
Well why don't you just reach out and take his trampoline.,['Joey Tribbiani'],Neutral,4,18,2,21,00:06:44.445,00:06:52.494
"Ok, here, I know what we can do.",['Rachel Green'],Neutral,4,19,2,21,00:06:50.034,00:06:54.830
"Hey, hey, hey no.",['Joey Tribbiani'],Mad,4,20,2,21,00:06:53.162,00:06:54.830
"Well if he's not gonna eat it, I will.",['Joey Tribbiani'],Neutral,4,22,2,21,00:07:09.095,00:07:14.141
Are you crazy?,['Phoebe Buffay'],Scared,4,23,2,21,00:07:11.973,00:07:14.141
"Phoebs, he's just a little dog. Ahhh.",['Joey Tribbiani'],Scared,4,24,2,21,00:07:14.684,00:07:18.103
"Hey Phoeb's, I think you're good to go.",['Joey Tribbiani'],Neutral,6,2,2,21,00:09:43.374,00:09:45.584
"Yeah, I don't know.",['Phoebe Buffay'],Sad,6,3,2,21,00:09:45.793,00:09:47.544
What's the matter?,['Rachel Green'],Scared,6,4,2,21,00:09:49.547,00:09:50.630
"Yeah Phoebe, I completely understand.",['Rachel Green'],Peaceful,6,6,2,21,00:09:50.798,00:09:53.300
"Yeah, whatever you need. Hey, you wanna go home?",['Joey Tribbiani'],Peaceful,6,7,2,21,00:10:21.370,00:10:28.293
"Ok, thanks. Sorry, again",['Phoebe Buffay'],Sad,6,8,2,21,00:10:23.414,00:10:24.998
What was that?,['Phoebe Buffay'],Scared,6,9,2,21,00:10:26.500,00:10:28.293
"Uhh, I'm guessing the threshold's clear now.",['Joey Tribbiani'],Scared,6,10,2,21,00:10:44.727,00:10:59.240
Your cappucino sir.,['Chandler Bing'],Neutral,8,2,2,21,00:10:50.107,00:10:52.067
Thank you.,['Ross Geller'],Neutral,8,3,2,21,00:10:54.528,00:10:59.240
Absolutely.,['Ross Geller'],Joyful,8,5,2,21,00:11:03.162,00:11:05.497
How come it's not mixing with the water?,['Ross Geller'],Scared,8,6,2,21,00:13:46.450,00:14:01.381
Ok.,['Chandler Bing'],Neutral,8,9,2,21,00:13:59.004,00:14:01.381
No.,['Ross Geller'],Powerful,8,10,2,21,00:14:01.549,00:14:04.092
No?,['Chandler Bing'],Scared,8,11,2,21,00:14:04.260,00:14:06.803
"Alright, hang on a second there Custer.",['Chandler Bing'],Neutral,8,13,2,21,00:14:41.672,00:14:44.090
"Yeah, sure.",['Ross Geller'],Neutral,8,15,2,21,00:14:45.843,00:14:48.136
By someone besides Monica?,['Joey Tribbiani'],Scared,8,16,2,21,00:14:48.304,00:14:52.682
"Well, couldn't we just lose our virginities again? Ya know, because I think actually mine's growing back.",['Chandler Bing'],Joyful,8,18,2,21,00:14:58.606,00:15:09.115
I need to borrow a hundred bucks.,['Monica Geller'],Scared,9,2,2,21,00:15:11.410,00:15:15.622
What?,['Rachel Green'],Scared,9,3,2,21,00:15:13.370,00:15:15.622
For what?,['Rachel Green'],Scared,9,5,2,21,00:15:15.915,00:15:17.498
I've gotta get back in the game.,['Monica Geller'],Scared,9,6,2,21,00:15:17.708,00:15:20.168
Oh no.,['Rachel Green'],Sad,9,9,2,21,00:15:20.336,00:15:23.338
"Hey, I've come to terms with it, you have to too.",['Monica Geller'],Neutral,9,10,2,21,00:15:23.547,00:15:29.510
"Ok. Look uhh, Mon I'm, I'm really sorry.",['Rachel Green'],Scared,9,11,2,21,00:15:27.551,00:15:34.974
"Yeah, yeah, yeah, where are we on the hundred bucks?",['Monica Geller'],Neutral,9,12,2,21,00:15:29.720,00:15:34.974
"I, I don't have it.",['Rachel Green'],Scared,9,13,2,21,00:15:33.307,00:15:34.974
Nobody does honey.,['Rachel Green'],Sad,9,15,2,21,00:15:35.184,00:15:36.392
"God, that was, that was amazing, that was incredible. You guys, you guys kicked butt.",['Ross Geller'],Joyful,12,2,2,21,00:21:05.180,00:21:15.898
"Us, what about you guys? Man you really, bing, gave it to old Mr. Clean back there. He was a big guy.",['Little Bully'],Joyful,12,3,2,21,00:21:12.980,00:21:21.570
Yeah he was wasn't he.,['Ross Geller'],Neutral,12,4,2,21,00:21:16.066,00:21:19.026
"Yeah, I wouldn't know having missed everything.",['Chandler Bing'],Sad,12,5,2,21,00:21:21.738,00:21:26.534
Don't do that to yourself. Any one of us could have tripped over that little girls jump-rope.,['Big Bully'],Scared,12,6,2,21,00:21:24.366,00:21:29.620
"So, listen guys, are we uh, are we ok here?",['Ross Geller'],Scared,12,7,2,21,00:21:32.749,00:21:38.170
We're ok.,['Little Bully'],Neutral,12,8,2,21,00:21:36.878,00:21:38.170
Alright.,['Ross Geller'],Neutral,12,9,2,21,00:21:39.840,00:21:41.465
"Ok so, can I have my hat back?",['Chandler Bing'],Joyful,12,10,2,21,00:21:41.675,00:21:43.884
No.,['Little Bully'],Mad,12,11,2,21,00:21:45.595,00:21:47.013
Huh.,['Chandler Bing'],Neutral,12,12,2,21,00:21:47.723,00:21:49.265
Look at her.,['Rachel Green'],Neutral,13,2,2,21,00:22:00.444,00:22:01.736
Hi Monica.,['Chandler Bing'],Neutral,13,3,2,21,00:22:02.279,00:22:03.362
"He-he-he, how's it goin'?",['Joey Tribbiani'],Joyful,13,4,2,21,00:22:03.530,00:22:07.033
Hey nice boobs.,['Phoebe Buffay'],Joyful,13,5,2,21,00:22:05.282,00:22:07.033
"Guys guys, check this out.",['Chandler Bing'],Joyful,13,6,2,21,00:22:07.242,00:22:11.454
Excellent.,['Joey Tribbiani'],Neutral,13,7,2,21,00:22:09.995,00:22:11.454
Ohhh.,['#ALL#'],Mad,1,3,2,22,00:00:07.966,00:00:10.551
What?,['Monica Geller'],Neutral,1,4,2,22,00:00:10.719,00:00:13.220
Question. Why do we always have to have parties where you poach things?,['Ross Geller'],Neutral,1,5,2,22,00:00:13.388,00:00:20.561
You wanna be in charge of the food committee?,['Monica Geller'],Scared,1,6,2,22,00:00:21.396,00:00:23.147
Question two. Why do we always have to have parties with committees?,['Ross Geller'],Neutral,1,7,2,22,00:00:23.314,00:00:28.736
Really. Why can't we just get some pizzas and get some beers and have fun?,['Joey Tribbiani'],Neutral,1,8,2,22,00:00:26.568,00:00:30.946
Yeah.,['Ross Geller'],Neutral,1,9,2,22,00:00:28.903,00:00:30.946
"Yeah, I agree. Ya know, I think fancy parties are only fun if you're fancy on the inside and I'm just not sure we are.",['Phoebe Buffay'],Neutral,1,10,2,22,00:00:31.114,00:00:36.869
"Alright. If you guys don't want it to be special, fine. You can throw any kind of party you want.",['Monica Geller'],Mad,1,11,2,22,00:00:38.371,00:00:43.500
"Joey they're not real. I start miles beneath the surface of these things, ok, they're fake. See honk honk.",['Monica Geller'],Mad,1,12,2,22,00:00:40.832,00:00:50.883
"Wow, it's, it's like porno for clowns.",['Chandler Bing'],Joyful,1,13,2,22,00:00:51.051,00:00:57.347
"I talked to Rachel's sisters, neither of them can come.",['Ross Geller'],Neutral,2,2,2,22,00:00:54.095,00:01:50.484
"Ok, um so, I still have to invite Dillon and Emma and Shannon Cooper.",['Monica Geller'],Neutral,2,3,2,22,00:01:47.649,00:01:54.154
"Woah, woah, woah, uh, no Shannon Cooper.",['Joey Tribbiani'],Powerful,2,4,2,22,00:01:50.652,00:01:54.154
Why not her?,['Phoebe Buffay'],Neutral,2,5,2,22,00:01:54.405,00:01:56.532
"Cause she uh, she steals stuff.",['Joey Tribbiani'],Neutral,2,6,2,22,00:01:56.741,00:02:01.203
Or maybe she doesn't steal stuff and Joey just slept with her and never called her back.,['Chandler Bing'],Mad,2,7,2,22,00:01:58.284,00:02:08.627
Joey that is horriable.,['Monica Geller'],Mad,2,8,2,22,00:02:03.623,00:02:05.290
"Hey I liked her, alright. Maybe, maybe too much. I don't know I guess I just got scared.",['Joey Tribbiani'],Scared,2,9,2,22,00:02:10.547,00:02:19.471
"I'm sorry, I didn't know.",['Phoebe Buffay'],Sad,2,10,2,22,00:02:13.675,00:02:17.010
"I didn't think anyone'd buy that, ok.",['Joey Tribbiani'],Neutral,2,11,2,22,00:02:17.178,00:02:22.391
"Hi honey, how did it go?",['Ross Geller'],Joyful,2,12,2,22,00:02:27.522,00:02:31.233
"Agh, it was the graduation from hell.",['Rachel Green'],Mad,2,13,2,22,00:02:46.833,00:02:52.296
So what happened?,['Monica Geller'],Neutral,2,16,2,22,00:02:49.169,00:02:52.296
"Ok, so I guess we don't invite her parents.",['Phoebe Buffay'],Neutral,2,18,2,22,00:03:08.605,00:03:13.650
"Well, how bout just her mom?",['Monica Geller'],Neutral,2,19,2,22,00:03:11.399,00:03:13.650
Why her mom?,['Chandler Bing'],Scared,2,20,2,22,00:03:13.818,00:03:16.361
Cause I already invited her.,['Monica Geller'],Neutral,2,21,2,22,00:03:16.779,00:03:18.697
"Ooh, ooh, did you ask Stacy Roth?",['Phoebe Buffay'],Neutral,2,22,2,22,00:03:19.282,00:03:22.743
"Oh no, can't invite her. She also steals.",['Joey Tribbiani'],Scared,2,23,2,22,00:03:21.451,00:03:36.798
"Ok, ok, you can be shirts and I'll be skins. I'll be skins. Hey, how you holdin' up there, tiger? Oh, sorry, when my parents were getting divorced I got a lot of tigers. Got a lot of champs, chiefs, sports, I even got a governor.",['Chandler Bing'],Joyful,6,2,2,22,00:17:31.216,00:17:58.034
"This is it, isn't it? I mean, this is what my life is gonna be like. My mom there, my dad there. Thanksgiving, Christmas. She gets the house, he's in some condo my sister's gonna decorate with wicker. Oh, Chandler how did you get through this?",['Rachel Green'],Sad,6,3,2,22,00:17:56.241,00:18:17.053
"Well, I relied on a carefully regimented program of denial and, and wetting the bed.",['Chandler Bing'],Neutral,6,4,2,22,00:18:17.429,00:18:31.859
"Ya know, I just, so weird. I mean I was in there just listening to them bitch about each other and all I kept thinking about was the fourth of July.",['Rachel Green'],Sad,6,5,2,22,00:18:21.725,00:18:39.784
Becasue it reminded you of the way our forefathers used to bitch at each other?,['Chandler Bing'],Neutral,6,6,2,22,00:18:41.411,00:18:45.873
"I, I know.",['Chandler Bing'],Peaceful,6,8,2,22,00:18:43.539,00:18:45.873
"Ok, thanks for coming, I hope you guys had fun.",['Monica Geller'],Peaceful,7,2,2,22,00:19:25.914,00:19:57.862
"Alright, Monica dear, I'm gonna hit the road. Now I've left my 10 verbs on the table. And you be sure and send me that finished poem.",['Sandra Green'],Peaceful,7,3,2,22,00:19:58.322,00:20:05.786
Ok will do. So glad you came.,['Monica Geller'],Joyful,7,4,2,22,00:20:05.954,00:20:07.997
I think I saw Rachel out in the hall.,['Sandra Green'],Neutral,7,5,2,22,00:20:08.165,00:20:10.625
"Ok, let me go check. Your mom want's to say goodbye.",['Monica Geller'],Neutral,7,6,2,22,00:20:10.792,00:20:15.963
Oh ok.,['Rachel Green'],Neutral,7,7,2,22,00:20:14.171,00:20:15.963
Happy birthday sweetie.,['Sandra Green'],Joyful,7,8,2,22,00:20:16.131,00:20:18.257
Ok.,['Rachel Green'],Powerful,7,9,2,22,00:20:18.425,00:20:20.092
"Ahh, you drive safe.",['Joey Tribbiani'],Peaceful,7,10,2,22,00:20:20.719,00:20:22.553
"Ross, what're you doing.",['Sandra Green'],Neutral,7,11,2,22,00:20:23.055,00:20:25.681
I'm getting ready for the water skiing. How are you doing?,['Ross Geller'],Peaceful,7,12,2,22,00:20:27.100,00:20:32.939
"Well, uh, Dr. Greene, where are you going?",['Chandler Bing'],Scared,7,13,2,22,00:20:36.026,00:20:41.530
To get my coat.,['Leonard Green'],Neutral,7,14,2,22,00:20:39.571,00:20:41.530
No no no.,['Guys'],Scared,7,15,2,22,00:20:41.698,00:20:43.366
"Alright, alright, I can get my own coat.",['Leonard Green'],Powerful,7,16,2,22,00:20:43.533,00:20:46.369
"Sorry, we're on a major flan high.",['Chandler Bing'],Joyful,7,17,2,22,00:20:47.037,00:20:56.796
"I have to be heading to my chateau, thank you.",['Leonard Green'],Powerful,7,19,2,22,00:21:17.776,00:21:23.739
"Oh all right, then I guess we're going back into the hallway.",['Phoebe Buffay'],Scared,7,20,2,22,00:21:21.613,00:21:26.867
"Thanks for coming Mrs. Greene. Well, ok, you take care.",['Joey Tribbiani'],Peaceful,7,21,2,22,00:21:27.035,00:21:48.723
"Oh, you kids Well, this is the best party I've been to in years.",['Sandra Green'],Joyful,7,22,2,22,00:21:38.964,00:21:57.064
Thank you.,['Monica Geller'],Peaceful,7,23,2,22,00:21:41.758,00:21:43.426
"Ok everybody, it's time for flan.",['Monica Geller'],Powerful,8,2,2,22,00:21:58.025,00:22:07.325
"Yup, get ready for the gelatenous fun.",['Chandler Bing'],Joyful,8,3,2,22,00:22:07.492,00:22:11.078
Kinda looks like that stuff you get when you get a bad infection.,['Joey Tribbiani'],Neutral,8,4,2,22,00:22:11.830,00:22:14.790
"Ok, that's enough.",['Monica Geller'],Neutral,8,5,2,22,00:22:14.958,00:22:17.209
"Ok Rachel, make a special flan wish.",['Phoebe Buffay'],Neutral,8,6,2,22,00:22:17.377,00:22:20.463
"Ok, I've got one. Wow, those things almost never come true.",['Rachel Green'],Joyful,8,7,2,22,00:22:21.506,00:22:34.060
"Hey Joey, how'd the audition go?",['Rachel Green'],Neutral,1,2,2,24,00:00:03.503,00:00:05.713
Incredible! I met the director this time and you'll never believe who it was.,['Joey Tribbiani'],Joyful,1,3,2,24,00:00:05.922,00:00:11.593
Who?,['#ALL#'],Neutral,1,4,2,24,00:00:08.717,00:00:09.758
All right. I'll give you one hint. Warren Beatty.,['Joey Tribbiani'],Neutral,1,5,2,24,00:00:10.093,00:00:18.726
Wow!,['#ALL#'],Joyful,1,6,2,24,00:00:12.053,00:00:14.138
